python/sglang/srt/lora/triton_ops/sgemm_configs/triton_3_6_0/lora_sgemm_a,K=7168,R=64,S=2,device=NVIDIA_GB200.json
{
    "1": {
        "BLOCK_S": 16,
        "BLOCK_N": 16,
        "BLOCK_K": 256,
        "num_warps": 4,
        "num_stages": 4
    },
    "2": {
        "BLOCK_S": 16,
        "BLOCK_N": 32,
        "BLOCK_K": 128,
        "num_warps": 4,
        "num_stages": 3
    },
    "3": {
        "BLOCK_S": 16,
        "BLOCK_N": 16,
        "BLOCK_K": 128,
        "num_warps": 4,
        "num_stages": 3
    },
    "4": {
        "BLOCK_S": 16,
        "BLOCK_N": 32,
        "BLOCK_K": 128,
        "num_warps": 4,
        "num_stages": 4
    },
    "5": {
        "BLOCK_S": 16,
        "BLOCK_N": 32,
        "BLOCK_K": 128,
        "num_warps": 4,
        "num_stages": 4
    },
    "6": {
        "BLOCK_S": 16,
        "BLOCK_N": 16,
        "BLOCK_K": 256,
        "num_warps": 4,
        "num_stages": 3
    },
    "7": {
        "BLOCK_S": 16,
        "BLOCK_N": 32,
        "BLOCK_K": 128,
        "num_warps": 4,
        "num_stages": 4
    },
    "8": {
        "BLOCK_S": 16,
        "BLOCK_N": 16,
        "BLOCK_K": 256,
        "num_warps": 4,
        "num_stages": 3
    },
    "16": {
        "BLOCK_S": 16,
        "BLOCK_N": 32,
        "BLOCK_K": 128,
        "num_warps": 4,
        "num_stages": 4
    },
    "24": {
        "BLOCK_S": 16,
        "BLOCK_N": 16,
        "BLOCK_K": 256,
        "num_warps": 4,
        "num_stages": 4
    },
    "32": {
        "BLOCK_S": 16,
        "BLOCK_N": 16,
        "BLOCK_K": 128,
        "num_warps": 4,
        "num_stages": 3
    },
    "48": {
        "BLOCK_S": 16,
        "BLOCK_N": 16,
        "BLOCK_K": 128,
        "num_warps": 4,
        "num_stages": 4
    },
    "64": {
        "BLOCK_S": 16,
        "BLOCK_N": 16,
        "BLOCK_K": 256,
        "num_warps": 4,
        "num_stages": 3
    },
    "512": {
        "BLOCK_S": 16,
        "BLOCK_N": 16,
        "BLOCK_K": 128,
        "num_warps": 4,
        "num_stages": 3
    },
    "1024": {
        "BLOCK_S": 16,
        "BLOCK_N": 32,
        "BLOCK_K": 128,
        "num_warps": 4,
        "num_stages": 3
    },
    "2048": {
        "BLOCK_S": 32,
        "BLOCK_N": 32,
        "BLOCK_K": 256,
        "num_warps": 4,
        "num_stages": 3
    },
    "4096": {
        "BLOCK_S": 32,
        "BLOCK_N": 32,
        "BLOCK_K": 256,
        "num_warps": 4,
        "num_stages": 3
    },
    "8192": {
        "BLOCK_S": 32,
        "BLOCK_N": 64,
        "BLOCK_K": 256,
        "num_warps": 8,
        "num_stages": 3
    }
}
